{
  "id": "SAR-0005",
  "author": "ಸರ್ವಜ್ಞ",
  "work": "ಸರ್ವಜ್ಞ ತ್ರಿಪದಿಗಳು",
  "tripadi_number": 5,
  "original": "ಗಂಡಾಗಬೇಕೆಂದು । ಪಿರಿಂಡವ ನುಂಗಲು\nಲಂಡೆ ಮಾಳ್ವೆಯೊಳು ಜನಿಸಿ - ಲೋಕದೊಳು\nಕಂಡುದನೆ ಪೇಳ್ವೆ ಸರ್ವಜ್ಞ",
  "padartha": "ಜನನಕ್ಕೆ ಸಂಬಂಧಿಸಿದ ಜನಪ್ರಚಲಿತ ಕಥನದ ಮತ್ತೊಂದು ಘಟನೆಯನ್ನು ಹೇಳುವ ತ್ರಿಪದಿ.",
  "bhavartha": "ಈ ತ್ರಿಪದಿ ಕೂಡ ಸರ್ವಜ್ಞನ ಜನನದ ಕುರಿತ ಪರಂಪರೆಯ ಕಥನದ ಭಾಗವಾಗಿದೆ. ಪಠ್ಯದ ಪದಪ್ರಯೋಗಗಳು ಹಳೆಯ ಕನ್ನಡದ ಸಾಂಸ್ಕೃತಿಕ ಸಂದರ್ಭಕ್ಕೆ ಸೇರಿದವು; ಆದ್ದರಿಂದ ಪದಾರ್ಥ ಮತ್ತು ಭಾವಾರ್ಥವನ್ನು ಮೂಲಪಠ್ಯದಿಂದ ಪ್ರತ್ಯೇಕವಾಗಿ ನೀಡಬೇಕು.",
  "life_message": "ಹಳೆಯ ಸಾಹಿತ್ಯವನ್ನು ಅರ್ಥಮಾಡಿಕೊಳ್ಳುವಾಗ ಕಾಲ, ಭಾಷೆ ಮತ್ತು ಸಂಸ್ಕೃತಿಯ ಹಿನ್ನೆಲೆಯನ್ನು ಪರಿಗಣಿಸುವುದು ಅಗತ್ಯ.",
  "category": "ಜೀವನಚರಿತ್ರೆ",
  "keywords": [
    "ಸರ್ವಜ್ಞ",
    "ಜನನ",
    "ಪರಂಪರೆ",
    "ಹಳೆಯ ಕನ್ನಡ"
  ],
  "source": {
    "source_id": "SRC-002",
    "title": "ಸರ್ವಜ್ಞನ ವಚನಗಳು — Kannada Wikisource",
    "publisher": "Kannada Wikisource",
    "year": null,
    "locator": "ಜಾತಿಸ್ಮರಣ ಪದ್ದತಿ, ೫",
    "url": "https://kn.wikisource.org/wiki/ಸರ್ವಜ್ಞನ_ವಚನಗಳು",
    "verified": true,
    "notes": "Cross-check against SRC-001 pending."
  },
  "rights": {
    "status": "needs_review",
    "license": "CC BY-SA (Wikisource page license; preserve attribution/share-alike requirements)",
    "permission_reference": "https://kn.wikisource.org/wiki/ವಿಕಿಸೋರ್ಸ್:Copyright"
  },
  "review_status": "editorial_review",
  "version": "1.0.0",
  "created_at": "2026-08-14",
  "updated_at": "2026-08-14"
}